{
  "$schema": "https://json-schema.org/draft/2020-12/schema",
  "$id": "https://formspec.org/schemas/changelog/1.0",
  "title": "Formspec Changelog Document",
  "description": "Enumerates differences between two versions of a Formspec Definition. Each change is an atomic record describing an addition, removal, modification, move, or rename of a definition element (item, bind, shape, optionSet, dataSource, screener, migration, or metadata). Impact classification (breaking/compatible/cosmetic) drives semver governance and migration generation.",
  "type": "object",
  "required": ["$formspecChangelog", "definitionUrl", "fromVersion", "toVersion", "semverImpact", "changes"],
  "additionalProperties": false,
  "properties": {
    "$formspecChangelog": {
      "type": "string",
      "const": "1.0",
      "description": "Changelog specification version. MUST be '1.0'.",
      "examples": ["1.0"],
      "x-lm": {
        "critical": true,
        "intent": "Version pin for changelog document compatibility."
      }
    },
    "$schema": {
      "type": "string",
      "format": "uri"
    },
    "definitionUrl": {
      "type": "string",
      "format": "uri",
      "description": "Canonical URL of the Definition whose versions are compared. Must match the definition's top-level 'url' property.",
      "examples": ["https://example.org/forms/grant-application"],
      "x-lm": {
        "critical": true,
        "intent": "Canonical identifier of the form definition whose versions are compared."
      }
    },
    "fromVersion": {
      "type": "string",
      "minLength": 1,
      "description": "Base version (before changes). Interpreted per the definition's versionAlgorithm (default: semver).",
      "examples": ["2.1.0"],
      "x-lm": {
        "critical": true,
        "intent": "Starting version for the changelog diff."
      }
    },
    "toVersion": {
      "type": "string",
      "minLength": 1,
      "description": "Target version (after changes). Interpreted per the definition's versionAlgorithm (default: semver).",
      "examples": ["3.0.0"],
      "x-lm": {
        "critical": true,
        "intent": "Destination version for the changelog diff."
      }
    },
    "generatedAt": {
      "type": "string",
      "format": "date-time",
      "description": "ISO 8601 timestamp when this changelog was generated.",
      "examples": ["2025-07-10T14:30:00Z"]
    },
    "semverImpact": {
      "type": "string",
      "enum": ["major", "minor", "patch"],
      "description": "Maximum impact across all changes. Must equal the highest impact in the changes array: breaking → major, compatible → minor, cosmetic → patch.",
      "examples": ["major"],
      "x-lm": {
        "critical": true,
        "intent": "Computed aggregate semantic-version impact for the release. Drives CI/CD gates and migration requirements."
      }
    },
    "summary": {
      "type": "string",
      "description": "Human-readable summary of changes for release notes.",
      "examples": ["Removes legacy budget fields; adds new personnel section."]
    },
    "changes": {
      "type": "array",
      "items": { "$ref": "#/$defs/Change" },
      "description": "Ordered array of Change objects. Each entry describes one atomic modification to a definition element.",
      "examples": [
        [
          {
            "type": "removed",
            "target": "item",
            "path": "items.budget.legacyCost",
            "key": "legacyCost",
            "impact": "breaking",
            "description": "Removed deprecated cost field.",
            "before": { "key": "legacyCost", "dataType": "currency" },
            "migrationHint": "drop"
          },
          {
            "type": "added",
            "target": "item",
            "path": "items.budget.personnel",
            "key": "personnel",
            "impact": "compatible",
            "description": "New personnel budget group.",
            "after": { "key": "personnel", "type": "group" }
          }
        ]
      ],
      "x-lm": {
        "critical": true,
        "intent": "Atomic change records used for migration generation, impact analysis, and reviewer notifications."
      }
    }
  },
  "$defs": {
    "Change": {
      "type": "object",
      "description": "A single atomic modification to a definition element. The combination of type + target + path uniquely identifies what changed; impact classifies severity; before/after capture the structural diff; migrationHint suggests how to transform existing response data.",
      "required": ["type", "target", "path", "impact"],
      "additionalProperties": false,
      "properties": {
        "type": {
          "type": "string",
          "enum": ["added", "removed", "modified", "moved", "renamed"],
          "description": "Kind of change. 'added': new element in toVersion. 'removed': element absent in toVersion. 'modified': element exists in both but properties differ. 'moved': element relocated to a different parent group (key preserved). 'renamed': item key changed (detected heuristically — unpaired remove/add with matching dataType, children, and binds).",
          "examples": ["added", "removed", "modified"],
          "x-lm": {
            "critical": true,
            "intent": "Determines which of before/after is present and how migration tooling interprets the change."
          }
        },
        "target": {
          "type": "string",
          "enum": ["item", "bind", "shape", "optionSet", "dataSource", "screener", "migration", "metadata"],
          "description": "Category of affected definition element. 'item': field, group, or display node. 'bind': reactive behavioral declaration (calculate, relevant, required, readonly, constraint). 'shape': composable validation rule. 'optionSet': named reusable option list. 'dataSource': secondary instance declaration. 'screener': routing rule. 'migration': version migration map. 'metadata': top-level properties (title, description, status, formPresentation).",
          "examples": ["item", "bind", "shape"],
          "x-lm": {
            "critical": true,
            "intent": "Scopes the change to a definition subsystem so tooling can route to the appropriate diff handler."
          }
        },
        "path": {
          "type": "string",
          "minLength": 1,
          "description": "Dot-path to the affected element within the definition. For items: 'items.' prefix followed by group nesting (e.g., 'items.budget.personnel'). For binds: the bind's target path (e.g., 'budget.totalCost'). For shapes: 'shapes.' + shape id. For optionSets: 'optionSets.' + set name. For metadata: the property name (e.g., 'title', 'status').",
          "examples": [
            "items.contact.phone",
            "items.budget.personnel.salary",
            "budget.totalCost",
            "shapes.budgetBalance",
            "optionSets.stateList",
            "title"
          ],
          "x-lm": {
            "critical": true,
            "intent": "Locates the affected element for programmatic diff application and human review navigation."
          }
        },
        "key": {
          "type": "string",
          "description": "The item's key property when target is 'item'. Provides the stable identifier used to match items across versions.",
          "examples": ["phone", "legacyCost", "personnel"]
        },
        "impact": {
          "type": "string",
          "enum": ["breaking", "compatible", "cosmetic"],
          "description": "Severity classification of this change. 'breaking' (→ major): existing responses may be invalid — item removed, key renamed, dataType changed, required added to existing field, repeat toggled, itemType changed, option removed from closed set. 'compatible' (→ minor): additive, no data loss — optional item added, option added, constraint relaxed, item moved, new shape/bind. 'cosmetic' (→ patch): display-only — label/hint/description/help changed, display order changed.",
          "examples": ["breaking", "compatible", "cosmetic"],
          "x-lm": {
            "critical": true,
            "intent": "Drives semver bump computation, CI/CD gates, and migration requirement assessment. The document-level semverImpact must equal the maximum impact across all changes."
          }
        },
        "description": {
          "type": "string",
          "description": "Human-readable description of the change for release notes and reviewer context.",
          "examples": [
            "Removed deprecated cost field.",
            "Added optional phone field.",
            "Updated label from 'E-mail' to 'Email address'.",
            "Renamed 'cost' → 'totalCost'.",
            "Moved from 'budget' group to 'personnel' group."
          ]
        },
        "before": {
          "description": "Previous value or structural fragment. Present for 'modified' (changed properties only), 'removed' (full element snapshot), 'renamed' (object with old key), and 'moved' (object with old path). Omitted for 'added'.",
          "examples": [
            { "key": "legacyCost", "dataType": "currency" },
            { "label": "E-mail" },
            { "key": "cost" },
            { "path": "items.budget.salary" }
          ]
        },
        "after": {
          "description": "New value or structural fragment. Present for 'added' (full element snapshot), 'modified' (changed properties only), 'renamed' (object with new key), and 'moved' (object with new path). Omitted for 'removed'.",
          "examples": [
            { "key": "phone", "type": "field", "label": "Phone", "dataType": "string" },
            { "label": "Email address" },
            { "key": "totalCost" },
            { "path": "items.personnel.salary" }
          ]
        },
        "migrationHint": {
          "type": "string",
          "description": "Suggested transform for existing response data. Three forms: 'drop' (discard the value), 'preserve' (carry forward unchanged or into extension data), or a FEL expression referencing $old (e.g., '$old.cost', 'string($old.amount)'). Used to auto-generate §6.7 migration fieldMap entries.",
          "examples": ["drop", "preserve", "$old.cost", "string($old.amount)", "$old.field ?? 'default'"]
        }
      }
    }
  }
}
